# name: test/sql/function/sql-pgq/test_shortest_path.test
# description: Test shortest path function
# group: [sql-pgq]

require sqlpgq

statement ok
CREATE TABLE Customer(cid bigint not null, name string);

statement ok
CREATE TABLE Transfers(tid bigint, from_id bigint, to_id bigint, amount bigint);

statement ok
INSERT INTO Customer VALUES (197, 'A'), (201, 'B'), (343, 'C'), (353, 'D');

statement ok
INSERT INTO Transfers VALUES
    (955, 197, 201, 100),
    (124, 201, 343, 500),
    (124, 343, 197, 500);

statement ok
insert into transfers select tid, to_id, from_id, amount from transfers;

statement ok
SELECT min(CREATE_CSR_EDGE(0, (SELECT count(c.cid) as vcount FROM Customer c),
CAST ((SELECT sum(CREATE_CSR_VERTEX(0, (SELECT count(c.cid) as vcount FROM Customer c),
sub.dense_id, sub.cnt )) AS numEdges
FROM (
    SELECT c.rowid as dense_id, count(t.from_id) as cnt
    FROM Customer c
    LEFT JOIN  Transfers t ON t.from_id = c.cid
    GROUP BY c.rowid
) sub) AS BIGINT),
src.rowid, dst.rowid, t.rowid, t.amount))
FROM
  Transfers t
  JOIN Customer src ON t.from_id = src.cid
  JOIN Customer dst ON t.to_id = dst.cid

statement ok
CREATE TABLE src_dest(id int, v_size bigint, src bigint, dst bigint);

statement ok
INSERT INTO src_dest VALUES(0, 4, 0, 2), (0, 4, 1, 2), (0, 4, 3, 0), (0, 4, 0, 1), (0, 4, 0, 0);

query T
SELECT shortestpath(0, v_size, src, dst) FROM src_dest;
----
[0, 2]
[1, 2]
NULL
[0, 1]
[0]

statement ok
INSERT INTO Transfers VALUES
    (123, 343, 353, 100),
    (123, 353, 343, 100);

statement ok
DELETE FROM src_dest;

statement ok
INSERT INTO src_dest VALUES (0, 4, 0, 3);

statement ok
PRAGMA delete_csr=0;

statement ok
SELECT min(CREATE_CSR_EDGE(0, (SELECT count(c.cid) as vcount FROM Customer c),
CAST ((SELECT sum(CREATE_CSR_VERTEX(0, (SELECT count(c.cid) as vcount FROM Customer c),
sub.dense_id, sub.cnt )) AS numEdges
FROM (
    SELECT c.rowid as dense_id, count(t.from_id) as cnt
    FROM Customer c
    LEFT JOIN  Transfers t ON t.from_id = c.cid
    GROUP BY c.rowid
) sub) AS BIGINT),
src.rowid, dst.rowid, t.rowid, t.amount))
FROM
  Transfers t
  JOIN Customer src ON t.from_id = src.cid
  JOIN Customer dst ON t.to_id = dst.cid

query T
SELECT shortestpath(0, v_size, src, dst) FROM src_dest;
----
[0, 2, 3]

statement ok
PRAGMA delete_csr=0;

statement ok
DELETE FROM src_dest;

statement ok
DELETE FROM Transfers;

statement ok
INSERT INTO Transfers VALUES
    (124, 197, 343, 500),
    (124, 201, 343, 500),
    (124, 343, 353, 500),

statement ok
SELECT min(CREATE_CSR_EDGE(0, (SELECT count(c.cid) as vcount FROM Customer c),
CAST ((SELECT sum(CREATE_CSR_VERTEX(0, (SELECT count(c.cid) as vcount FROM Customer c),
sub.dense_id, sub.cnt )) AS numEdges
FROM (
    SELECT c.rowid as dense_id, count(t.from_id) as cnt
    FROM Customer c
    LEFT JOIN  Transfers t ON t.from_id = c.cid
    GROUP BY c.rowid
) sub) AS BIGINT),
src.rowid, dst.rowid, t.rowid, t.amount))
FROM
  Transfers t
  JOIN Customer src ON t.from_id = src.cid
  JOIN Customer dst ON t.to_id = dst.cid

statement ok
INSERT INTO src_dest VALUES
    (0, 4, 0, 3),
    (0, 4, 1, 3)

query T
SELECT shortestpath(0, v_size, src, dst) FROM src_dest;
----
[0, 2, 3]
[1, 2, 3]
